{"idNumber":"9999999999999","prefix":"นาย","nameThai":"สุขใจ","surnameThai":"สบายใจ","prefixEng":"Sookjai","nameEng":null,"surnameEng":"Sabaijai","dobThai":"","dob":"","address":"","issueDateThai":"02 ต.ค. 2534","issueDate":"","expiryDateThai":"","expiryDate":"02 Oct 1999","ocrText":"บัตรประจำตัวประชาชน Thai National ID Card\nเลขประจำตัวประชาชน\nIdentification Number 9 9999 99999 99 9\nชื่อตัวและชื่อสกุล นาย สุขใจ สบายใจ\nName Sookjai\nbaijaาง\nอยู่ 00.00 2.0 กรุงเทพมหานคร สมัคร\n02 ต.ค. 2534\nวันออกบัตร\nLast name Sabaijai\nวันเกิดที่ 02 ต.ค. 2534\nDate of birth 02 Oct 1991\n02 Oct 1991\nDate of Issue\n(XX XXXX XXXX)\nเจ้าพนักงานออกบัตร\n02 ต.ค. 2542\nวันหมดบัตรอายุ\n02 Oct 1999\nDate of Expiry\n170\n160\n999-99-99999999\nบัตร\nประจำ\nตัว\nประชาชน\nThai\nNational\nID\nCard\nเลข\nประจำ\nตัว\nประชาชน\nIdentification\nNumber\n9\n9999\n99999\n99\n9\nชื่อ\nตัว\nและ\nชื่อสกุล\nนาย\nสุขใจ\nสบายใจ\nName\nSookjai\nbaija\nา\nง\nอยู่\n00.00\n2.0\nกรุงเทพมหานคร\nสมัคร\n02\nต.ค.\n2534\nวัน\nออก\nบัตร\nLast\nname\nSabaijai\nวัน\nเกิด\nที่\n02\nต.ค.\n2534\nDate\nof\nbirth\n02\nOct\n1991\n02\nOct\n1991\nDate\nof\nIssue\n(\nXX\nXXXX\nXXXX\n)\nเจ้าพนักงาน\nออก\nบัตร\n02\nต.ค.\n2542\nวัน\nหมด\nบัตร\nอายุ\n02\nOct\n1999\nDate\nof\nExpiry\n170\n160\n999-99-99999999"}