{"idNumber":"1234567890123","prefix":"นาย","nameThai":"ตัวอย่าง","surnameThai":"นามรอง","prefixEng":"Mr.","nameEng":"Sample","surnameEng":"Middle Name Satitsakul","dobThai":"30 มี.ค. 2508","dob":"30 Mar. 1965","address":"1\/11 หมู่ที่ 1 ตรอกปฐม ซ.สุขุมวิท 1 ถ.สุขุมวิท แขวงคลองเตยเหนือ เขตพระโขนง กรุงเทพมหานคร","issueDateThai":"31 S.A. 2550","issueDate":"","expiryDateThai":"","expiryDate":"","ocrText":"ข้อมูลประจำตัวประชาชน Thai National ID Card Data\nเลขประจําตัวประชาชน\nIdentification Number 1 2345 67890 12 3\nชื่อตัวและชื่อสกุล นาย ตัวอย่าง นามรอง สาธิตสกุล\nName Mr. Sample\nLast name Middle Name Satitsakul\nเกิดวันที่ 30 มี.ค. 2508\nDate of Birth 30 Mar. 1965\nที่อยู่ 1\/11 หมู่ที่ 1 ตรอกปฐม ซ.สุขุมวิท 1 ถ.สุขุมวิท\nแขวงคลองเตยเหนือ เขตพระโขนง กรุงเทพมหานคร\n31 S.A. 2550\nวันออกบัตร\n14 ส.ค. 2557\n11:52:14\nวันเวลาทีอ่านบัตร\n29 มี.ค. 2556\nนบัตรหมดอายุ\n29 Mar. 2013\n31 Dec. 2007\nDate of Issue\nwww.rd-comp.com Date of Expiry\nไม่ใช่บัตรประจําตัวประชาชน สร้างภาพบัตรโดย AThaiID V 1.0.0\n180.\n170\n160\n150.\n180\n160\n150\nข้อมูล\nประจำ\nตัว\nประชาชน\nThai\nNational\nID\nCard\nData\nเลข\nประ\nจํา\nตัว\nประชาชน\nIdentification\nNumber\n1\n2345\n67890\n12\n3\nชื่อ\nตัว\nและ\nชื่อสกุล\nนาย\nตัวอย่าง\nนาม\nรอง\nสาธิต\nสกุล\nName\nMr.\nSample\nLast\nname\nMiddle\nName\nSatitsakul\nเกิด\nวัน\nที่\n30\nมี.ค.\n2508\nDate\nof\nBirth\n30\nMar.\n1965\nที่\nอยู่\n1\/11\nหมู่\nที่\n1\nตรอก\nปฐม\nซ\n.\nสุขุมวิท\n1\nถ\n.\nสุขุมวิท\nแขวง\nคลองเตย\nเหนือ\nเขต\nพระโขนง\nกรุงเทพมหานคร\n31\nS.A.\n2550\nวัน\nออก\nบัตร\n14\nส.ค.\n2557\n11:52:14\nวัน\nเวลา\nที\nอ่าน\nบัตร\n29\nมี.ค.\n2556\nน\nบัตร\nหมดอายุ\n29\nMar.\n2013\n31\nDec.\n2007\nDate\nof\nIssue\nwww.rd-comp.com\nDate\nof\nExpiry\nไม่ใช่\nบัตร\nประ\nจํา\nตัว\nประชาชน\nสร้าง\nภาพ\nบัตร\nโดย\nAThaiID\nV\n1.0.0\n180\n.\n170\n160\n150\n.\n180\n160\n150"}