{"idNumber":"0123456789101","prefix":"นาย","nameThai":"หมีน้อยคอยรัก","surnameThai":null,"prefixEng":"Last","nameEng":"Name","surnameEng":"","dobThai":"(นายคน บุญคุ้ม)","dob":"14 Jan 1980","address":"2300 คาโลรามา วอชิงตัน ดี.ซี. 20007 2 ม.ค. 2566","issueDateThai":"2 ม.ค. 2566","issueDate":"","expiryDateThai":"1 ม.ค. 2573","expiryDate":"1 Jan 2032","ocrText":"บัตรประจําตัวประชาชน Thai National ID Card\n0 1234 56789 10 1\nเลขประจําตัวประชาชน\nIdentification Number\nชื่อตัวและชื่อสกุล\nนาย หมีน้อยคอยรัก\nMr. Meenoy\nKoyruk\n14 ม.ค. 2523\nDate of Birth 14 Jan 1980\nที่อยู่ 2300 คาโลรามา วอชิงตัน ดี.ซี. 20007\n2 ม.ค. 2566\nวันออกบัตร\n2 Jan 2023\nDate of Issue\nName\nLast Name\nเกิดวันที่\n(นายคน บุญคุ้ม)\nเจ้าพนักงานออกบัตร\n180-\n170\n10\n1 ม.ค. 2573\nวันบัตรหมดอายุ\n1 Jan 2032\nDate of Expiry\n180\n170\n160\nบัตร\nประ\nจํา\nตัว\nประชาชน\nThai\nNational\nID\nCard\n0\n1234\n56789\n10\n1\nเลข\nประ\nจํา\nตัว\nประชาชน\nIdentification\nNumber\nชื่อ\nตัว\nและ\nชื่อสกุล\nนาย\nหมี\nน้อย\nคอย\nรัก\nMr.\nMeenoy\nKoyruk\n14\nม.ค.\n2523\nDate\nof\nBirth\n14\nJan\n1980\nที่\nอยู่\n2300\nคา\nโล\nรา\nมา\nวอชิงตัน\nดี.ซี.\n20007\n2\nม.ค.\n2566\nวัน\nออก\nบัตร\n2\nJan\n2023\nDate\nof\nIssue\nName\nLast\nName\nเกิด\nวัน\nที่\n(\nนาย\nคน\nบุญ\nคุ้ม\n)\nเจ้าพนักงาน\nออก\nบัตร\n180\n170\n10\n1\nม.ค.\n2573\nวัน\nบัตร\nหมดอายุ\n1\nJan\n2032\nDate\nof\nExpiry\n180\n170\n160"}